ASIN,BrandName,ProductName,Rating,ReviewsCount,Price,Currency,Amazon_URL,Ulta_URL,Ulta_Name,Ulta_Price,Ulta_Rating
B09FYK9K6T,Neutrogena,"Neutrogena Anti-Aging Rapid Wrinkle Repair Retinol Regenerating Cream & Pro+, 0.5% Power Serum, Travel Size 1 Fl Oz, 0.5 Oz Mini, 1.5 Oz",4.488527017024427,87,,USD,https://www.amazon.com/dp/B09FYK9K6T/th=1&psc=1,https://www.ulta.com/p/travel-size-rapid-wrinkle-repair-regenerating-cream-pimprod2009569?sku=2554021,Travel Size Rapid Wrinkle Repair Regenerating Cream,Travel Size Rapid Wrinkle Repair Regenerating Cream,
B0BLRGCTS1,Neutrogena,"Neutrogena Purescreen+ Tinted Sunscreen for Face with SPF 30, Broad Spectrum Mineral Sunscreen with Zinc Oxide and Vitamin E, Water Resistant, Fragrance Free, Medium, 1.1 fl oz",3.9590887959088796,229,13.45,USD,https://www.amazon.com/dp/B0BLRGCTS1/th=1&psc=1,https://www.ulta.com/p/purescreen-tinted-mineral-sunscreen-pimprod2037357?sku=2606100,Purescreen+ Tinted Mineral Sunscreen,Purescreen+ Tinted Mineral Sunscreen,
B00U2VQZDS,Neutrogena,"Neutrogena Cleansing Fragrance Free Makeup Remover Face Wipes, Cleansing Facial Towelettes for Waterproof Makeup, Alcohol-Free, Unscented, 100% Plant-Based Fibers, Twin Pack, 2 x 25 ct",4.798320477852402,4505,10.27,USD,https://www.amazon.com/dp/B00U2VQZDS/th=1&psc=1,https://www.ulta.com/p/fragrance-free-makeup-remover-cleansing-towelettes-twin-pack-xlsImpprod16411139?sku=2512743,Fragrance-Free Makeup Remover Cleansing Towelettes Twin Pack,Fragrance-Free Makeup Remover Cleansing Towelettes Twin Pack,
B0B29YZH1P,Neutrogena,"Neutrogena Hydro Boost Gentle Exfoliating Daily Facial Cleanser with Hyaluronic Acid, Clinically Proven to Increase Skin's Hydration Level, Non-Comedogenic Oil-, Soap- & Paraben-Free, 3 x 5 Oz",4.723245109321058,41,26.30,USD,https://www.amazon.com/dp/B0B29YZH1P/th=1&psc=1,https://www.ulta.com/p/ultra-facial-cream-with-squalane-pimprod2002804?sku=2617288,Ultra Facial Cream with Squalane,Ultra Facial Cream with Squalane,
B0B3ZCG2NH,Neutrogena,"Neutrogena Hydro Boost Lightweight Hydrating Facial Gel Cleanser, Gentle Face Wash & Makeup Remover with Hyaluronic Acid, Hypoallergenic & Paraben-Free, 7.8 fl. oz",4.637636080870918,182,10.05,USD,https://www.amazon.com/dp/B0B3ZCG2NH/th=1&psc=1,https://www.ulta.com/p/hydro-boost-fragrance-free-gel-facial-cleanser-pimprod2035754?sku=2601193,Hydro Boost Fragrance-Free Gel Facial Cleanser,Hydro Boost Fragrance-Free Gel Facial Cleanser,
B0B3ZFBMVF,Neutrogena,"Neutrogena Hydro Boost Fragrance Free Hydrating Gel Facial Cleanser with Hyaluronic Acid, Daily Foaming Face Wash & Makeup Remover, Gentle Face Wash, Non-Comedogenic, 7.8 fl. oz",4.599431818181818,91,9.94,USD,https://www.amazon.com/dp/B0B3ZFBMVF/th=1&psc=1,https://www.ulta.com/p/hyaluronic-acid-2-b5-hydrating-serum-with-ceramides-pimprod2043525?sku=2618749,Hyaluronic Acid 2% + B5 Hydrating Serum with Ceramides,Hyaluronic Acid 2% + B5 Hydrating Serum with Ceramides,
B07FLD6T6Q,Neutrogena,"Neutrogena Night Calming Makeup Remover Face Wipes, Nighttime Cleansing Towelettes Remove Sweat, Dirt & Makeup & Calms Skin, Hypoallergenic, 100% Plant Based Cloth, Twin Pack, 2 x 25 ct",4.778828270303782,264,12.72,USD,https://www.amazon.com/dp/B07FLD6T6Q/th=1&psc=1,https://www.ulta.com/p/night-calming-makeup-remover-cleansing-towelettes-twin-pack-xlsImpprod13762449?sku=2298523,Night Calming Makeup Remover Cleansing Towelettes Twin Pack,Night Calming Makeup Remover Cleansing Towelettes Twin Pack,
B084K5HNCB,Neutrogena,"Neutrogena Makeup Remover Cleansing Face Wipes, Daily Cleansing Facial Towelettes to Remove Waterproof Makeup and Mascara, Alcohol-Free, Value Twin Pack, 25 Count, 2 Pack",4.798320477852402,216,13.47,USD,https://www.amazon.com/dp/B084K5HNCB/th=1&psc=1,https://www.ulta.com/p/fragrance-free-makeup-remover-cleansing-towelettes-twin-pack-xlsImpprod16411139?sku=2512743,Fragrance-Free Makeup Remover Cleansing Towelettes Twin Pack,Fragrance-Free Makeup Remover Cleansing Towelettes Twin Pack,
B088N4CB19,Neutrogena,"Neutrogena Gentle Oil-Free Eye Makeup Remover & Cleanser for Sensitive Eyes, Non-Greasy Makeup Remover, Removes Waterproof Mascara, Dermatologist & Ophthalmologist Tested, 3 x 5.5 fl. oz",4.6677820938830905,91,20.67,USD,https://www.amazon.com/dp/B088N4CB19/th=1&psc=1,https://www.ulta.com/p/oil-free-eye-makeup-remover-prod2109669?sku=2109669,Oil-Free Eye Makeup Remover,Oil-Free Eye Makeup Remover,
B097PCBMWG,Neutrogena,"Neutrogena Makeup Melting Nourishing Micellar Milk with 7% Emollient-Vitamin Complex, Soothing Fragrance-Free Eye, Lip & Face Makeup Remover for Sensitive & Dry Skin, Oil-Free, 6.7 fl. oz",4.068684516880093,76,9.98,USD,https://www.amazon.com/dp/B097PCBMWG/th=1&psc=1,https://www.ulta.com/p/hydro-boost-soothing-milk-facial-cleanser-pimprod2035755?sku=2601048,Hydro Boost Soothing Milk Facial Cleanser,Hydro Boost Soothing Milk Facial Cleanser,
B00NR1YQHM,Neutrogena,"Neutrogena Hydro Boost Face Moisturizer with Hyaluronic Acid for Dry Skin, Oil-Free and Non-Comedogenic Water Gel Face Lotion, 1.7 oz",4.635574185954334,8127,16.98,USD,https://www.amazon.com/dp/B00NR1YQHM/th=1&psc=1,https://www.ulta.com/p/hydro-boost-hyaluronic-acid-water-gel-moisturizer-fragrance-free-pimprod2041883?sku=2615397,"Hydro Boost Hyaluronic Acid Water Gel Moisturizer, Fragrance Free","Hydro Boost Hyaluronic Acid Water Gel Moisturizer, Fragrance Free",
B00NR1YQK4,Neutrogena,"Neutrogena Hydro Boost Hyaluronic Acid Hydrating Face Moisturizer Gel-Cream to Hydrate and Smooth Extra-Dry Skin, 1.7 oz",4.641624843161857,4942,18.27,USD,https://www.amazon.com/dp/B00NR1YQK4/th=1&psc=1,https://www.ulta.com/p/hydro-boost-hyaluronic-acid-water-gel-moisturizer-fragrance-free-pimprod2041883?sku=2615397,"Hydro Boost Hyaluronic Acid Water Gel Moisturizer, Fragrance Free","Hydro Boost Hyaluronic Acid Water Gel Moisturizer, Fragrance Free",
B07GPZYZBC,Neutrogena,"Neutrogena Rapid Wrinkle Repair 0.3% Concentrated Retinol Face Oil, Daily Anti-Aging Face Serum to Fight Fine Lines, Deep Wrinkles, & Dark Spots, 1.0 fl. oz",4.456097829679409,578,17.99,USD,https://www.amazon.com/dp/B07GPZYZBC/th=1&psc=1,https://www.ulta.com/p/ultra-sheer-face-serum-spf-60-pimprod2030654?sku=2592306,Ultra Sheer Face Serum SPF 60+,Ultra Sheer Face Serum SPF 60+,
B004D2C57M,Neutrogena,"Neutrogena Rapid Wrinkle Repair Retinol Face Moisturizer with SPF 30 Sunscreen, Daily Anti-Aging Face Cream with Retinol & Hyaluronic Acid to Fight Fine Lines, Wrinkles, & Dark Spots, 1 fl. oz",4.371536217792903,2453,20.96,USD,https://www.amazon.com/dp/B004D2C57M/th=1&psc=1,https://www.ulta.com/p/rapid-wrinkle-repair-retinol-pro-night-moisturizer-pimprod2035837?sku=2601053,Rapid Wrinkle Repair Retinol Pro+ Night Moisturizer,Rapid Wrinkle Repair Retinol Pro+ Night Moisturizer,
B00NR1YIKM,Neutrogena,"Neutrogena Hydro Boost Eye Cream, Under-Eye Moisturizer with Hyaluronic Acid, Fragrance Free and Non-Comedogenic, 0.5 Oz",4.469735720375106,1299,9.82,USD,https://www.amazon.com/dp/B00NR1YIKM/th=1&psc=1,https://www.ulta.com/p/hydro-boost-caffeine-eye-gel-cream-fragrance-free-pimprod2035834?sku=2601045,Hydro Boost+ Caffeine Eye Gel Cream - Fragrance Free,Hydro Boost+ Caffeine Eye Gel Cream - Fragrance Free,
B08936CZHQ,Neutrogena,"Neutrogena Hydro Boost Night Moisturizer for Face, Hyaluronic Acid Facial Serum for Dry Skin, Oil-Free and Non-Comedogenic, 1.7 oz",4.508798669807399,633,15.96,USD,https://www.amazon.com/dp/B08936CZHQ/th=1&psc=1,https://www.ulta.com/p/rapid-wrinkle-repair-retinol-pro-night-moisturizer-pimprod2035837?sku=2601053,Rapid Wrinkle Repair Retinol Pro+ Night Moisturizer,Rapid Wrinkle Repair Retinol Pro+ Night Moisturizer,
B08937VD6Z,Neutrogena,"Neutrogena Hydro Boost Hyaluronic Acid Serum For Face with Vitamin B5, Lightweight Hydrating Face Serum for Dry Skin, Oil-Free, Non-Comedogenic, Fragrance Free, 1 oz",4.569684374594103,418,14.34,USD,https://www.amazon.com/dp/B08937VD6Z/th=1&psc=1,https://www.ulta.com/p/hydro-boost-niacinamide-face-serum-fragrance-free-pimprod2035838?sku=2601030,Hydro Boost+ Niacinamide Face Serum - Fragrance Free,Hydro Boost+ Niacinamide Face Serum - Fragrance Free,
B097NNR535,Neutrogena,"Neutrogena Hydro Boost Hyaluronic Acid Facial Moisturizer with Broad Spectrum SPF 50 Sunscreen, Daily Water Gel Face Moisturizer to Hydrate & Soothe Dry Skin, Fragrance-Free, 1.7 fl. oz",4.363806605379639,671,,USD,https://www.amazon.com/dp/B097NNR535/th=1&psc=1,https://www.ulta.com/p/intensive-moisture-balance-moisturizer-pimprod2003120?sku=2535727,Intensive Moisture Balance Moisturizer,Intensive Moisture Balance Moisturizer,
B089394PCY,Neutrogena,"Neutrogena Rapid Tone Repair 20% Vitamin C Brightening Serum Capsules, Antioxidant Face Serum to Brighten Look of Dark Spots & Even Skin Tone, Oil-Free, 30 Serum Capsules",4.26009674879064,627,23.88,USD,https://www.amazon.com/dp/B089394PCY/th=1&psc=1,https://www.ulta.com/p/ultra-sheer-face-serum-spf-60-pimprod2030654?sku=2592306,Ultra Sheer Face Serum SPF 60+,Ultra Sheer Face Serum SPF 60+,
B005IHT94S,Neutrogena,"Neutrogena Ultra Sheer Dry-Touch Water Resistant and Non-Greasy Sunscreen Lotion with Broad Spectrum SPF 70, 3 Fl Oz (Pack of 1)",4.607441758362374,1617,8.32,USD,https://www.amazon.com/dp/B005IHT94S/th=1&psc=1,https://www.ulta.com/p/ultra-sheer-non-greasy-spf-60-face-sunscreen-stick-pimprod2049510?sku=2634860,Ultra Sheer Non-Greasy SPF 60 Face Sunscreen Stick,Ultra Sheer Non-Greasy SPF 60 Face Sunscreen Stick,
B08HWK8F9T,Neutrogena,"Neutrogena Invisible Daily Defense Face Serum with Broad Spectrum SPF 60+ to Help Even Skin Tone, Oil-Free, Non-Greasy, Antioxidant Complex for Environmental Aggressors, 1.7 fl. Oz",4.442678942678943,654,13.10,USD,https://www.amazon.com/dp/B08HWK8F9T/th=1&psc=1,https://www.ulta.com/p/ultra-sheer-face-serum-spf-60-pimprod2030654?sku=2592306,Ultra Sheer Face Serum SPF 60+,Ultra Sheer Face Serum SPF 60+,
B08L88LZ4V,Neutrogena,"Neutrogena Clear Face Liquid Lotion Sunscreen for Acne-Prone Skin, Broad Spectrum SPF 50 UVA/UVB Protection, Oil-, Fragrance- & Oxybenzone-Free Facial Sunscreen, Non-Comedogenic, 3 fl. oz",4.57535115541459,300,10.16,USD,https://www.amazon.com/dp/B08L88LZ4V/th=1&psc=1,https://www.ulta.com/p/clear-face-oil-free-sunscreen-spf-50-pimprod2021433?sku=2576185,Clear Face Oil-Free Sunscreen SPF 50,Clear Face Oil-Free Sunscreen SPF 50,
B0771GYTB3,Neutrogena,"Neutrogena Hydro Boost Moisturizing Water Gel Sunscreen Lotion with Broad Spectrum SPF 50, Water-Resistant & Non-Greasy Hydrating Sunscreen Lotion, Oil-Free, 3 fl. oz",4.534545454545454,341,20.99,USD,https://www.amazon.com/dp/B0771GYTB3/th=1&psc=1,https://www.ulta.com/p/hydro-boost-hyaluronic-acid-water-gel-moisturizer-fragrance-free-pimprod2041883?sku=2615397,"Hydro Boost Hyaluronic Acid Water Gel Moisturizer, Fragrance Free","Hydro Boost Hyaluronic Acid Water Gel Moisturizer, Fragrance Free",
B01LTI9PKW,Neutrogena,"Neutrogena Age Shield Face Oil-Free Sunscreen Lotion with Broad Spectrum SPF 70, Non-Comedogenic Moisturizing Sunscreen to Help Prevent Signs of Aging, PABA-Free, 3 fl. oz (Pack of 3)",4.604136446586495,123,29.80,USD,https://www.amazon.com/dp/B01LTI9PKW/th=1&psc=1,https://www.ulta.com/p/age-shield-face-oil-free-sunscreen-spf-70-xlsImpprod640120?sku=2154550,Age Shield Face Oil-Free Sunscreen SPF 70,Age Shield Face Oil-Free Sunscreen SPF 70,
B09MV3MHJD,Neutrogena,"Neutrogena Ultra Sheer Moisturizing Face Serum with Vitamin E & SPF 60+, All Day Facial Sunscreen Serum with Broad Spectrum UVA/UVB Protection, Fragrance-Free, Oxybenzone-Free, 1.7 oz",4.565722379603399,435,13.00,USD,https://www.amazon.com/dp/B09MV3MHJD/th=1&psc=1,https://www.ulta.com/p/yerba-mate-wake-up-eye-gel-pimprod2023933?sku=2582312,Yerba Mate Wake Up Eye Gel,Yerba Mate Wake Up Eye Gel,
B09MV4CDL1,Neutrogena,"Neutrogena Sun Rescue After Sun Rehydrating Spray with Hyaluronic Acid, Vegan and Lightweight 48-Moisturizing Skin and Body Mist, Non-Comedogenic Hydration, 6.7 Oz",4.678602620087336,99,,USD,https://www.amazon.com/dp/B09MV4CDL1/th=1&psc=1,https://www.ulta.com/p/oil-free-eye-makeup-remover-prod2109669?sku=2109669,Oil-Free Eye Makeup Remover,Oil-Free Eye Makeup Remover,
B0B3C3TJBF,Neutrogena,"Neutrogena Hydro Boost + Niacinamide Serum for Face with Hyaluronic Acid & Vitamin B3, Multi-Action Face Serum to Hydrate & Improve Skin Complexion & Refine Look of Pores, Fragrance Free, 1 oz",4.556047197640118,109,16.98,USD,https://www.amazon.com/dp/B0B3C3TJBF/th=1&psc=1,https://www.ulta.com/p/moisture-surge-100h-auto-replenishing-hydrator-gel-moisturizer-with-hyaluronic-acid-pimprod2021615?sku=2576545,Moisture Surge 100H Auto-Replenishing Hydrator Gel Moisturizer with Hyaluronic Acid,Moisture Surge 100H Auto-Replenishing Hydrator Gel Moisturizer with Hyaluronic Acid,
B0B3BX9PLP,Neutrogena,"Neutrogena Hydro Boost + Eye Cream for Dark Circles & Puffiness, Under Eye Cream with Caffeine, Hyaluronic Acid and Peptides, Fragrance Free, 0.5 oz",4.242592592592593,104,16.46,USD,https://www.amazon.com/dp/B0B3BX9PLP/th=1&psc=1,https://www.ulta.com/p/oil-free-eye-makeup-remover-prod2109669?sku=2109669,Oil-Free Eye Makeup Remover,Oil-Free Eye Makeup Remover,
B0814SFKG9,Neutrogena,"Neutrogena Hydro Boost Glow Booster Primer & Serum, Hydrating & Moisturizing Face Serum-to-Primer Hybrid, Infused with Purified Hyaluronic Acid & Designed to Instantly Hydrate, 1.0 fl. oz",4.443186962426437,168,16.97,USD,https://www.amazon.com/dp/B0814SFKG9/th=1&psc=1,https://www.ulta.com/p/power-grip-primer-pimprod2030073?sku=2591795,Power Grip Primer,Power Grip Primer,
B08221J29Y,Neutrogena,"Neutrogena Makeup Remover Melting Balm to Oil with Vitamin E, Gentle and Nourishing Makeup Removing Balm for Eye, Lip, or Face Makeup, Travel-Friendly for On-the-Go, 2.0 ounces",4.458476912474156,576,9.14,USD,https://www.amazon.com/dp/B08221J29Y/th=1&psc=1,https://www.ulta.com/p/makeup-remover-melting-balm-pimprod2025393?sku=2582619,Makeup Remover Melting Balm,Makeup Remover Melting Balm,
B0B2T9QW42,Neutrogena,"Neutrogena Rapid Wrinkle Repair Retinol Pro+ Anti-Wrinkle Night Moisturizer, Anti-Aging Face & Neck Cream, Formulated without fragrance, parabens, dyes, & phthalates, 0.3% Retinol, 1.7 oz",4.247572815533981,171,22.39,USD,https://www.amazon.com/dp/B0B2T9QW42/th=1&psc=1,https://www.ulta.com/p/hueguard-skin-tint-spf-50-mineral-sunscreen-broad-spectrum-pimprod2043870?sku=2621479,Hueguard Skin Tint SPF 50 Mineral Sunscreen Broad Spectrum,Hueguard Skin Tint SPF 50 Mineral Sunscreen Broad Spectrum,
B0BNC5ZF3T,Neutrogena,"Neutrogena Alcohol-Free Gentle Daily Fragrance-Free Face Toner to Tone & Refresh Skin, Toner Gently Removes Impurities & Reconditions Skin, Hypoallergenic, 8 fl. oz",4.526262626262627,146,6.27,USD,https://www.amazon.com/dp/B0BNC5ZF3T/th=1&psc=1,https://www.ulta.com/p/facial-radiance-pads-with-glycolic-lactic-acids-pimprod2040110?sku=2632111,Facial Radiance Pads with Glycolic + Lactic Acids,Facial Radiance Pads with Glycolic + Lactic Acids,
B08BJMG1SC,Neutrogena,"Neutrogena Rapid Tone Repair Retinol + Vitamin C Correcting Cream, Tone Evening Face & Neck Cream with Retinol & Hyaluronic Acid for Dark Spots, Fine Lines & Wrinkles, 1.7 oz",4.410028038924625,215,25.69,USD,https://www.amazon.com/dp/B08BJMG1SC/th=1&psc=1,https://www.ulta.com/p/essential-drip-glossy-balm-pimprod2044812?sku=2622473,Essential Drip Glossy Balm,Essential Drip Glossy Balm,
B07DJWZLQL,Neutrogena,"Neutrogena Hydro Boost Body Moisturizing Gel Cream with Hyaluronic Acid, Non-Greasy & Fast Absorbing, Lightweight Hydrating Body Lotion for Normal to Dry Skin, Paraben- & Dye-Free, 16 oz",4.743737721021611,814,,USD,https://www.amazon.com/dp/B07DJWZLQL/th=1&psc=1,https://www.ulta.com/p/dewy-skin-cream-line-plumping-moisturizer-pimprod2049087?sku=2634100,The Dewy Skin Cream Line-Plumping Moisturizer,The Dewy Skin Cream Line-Plumping Moisturizer,
B076H45H68,Neutrogena,"Neutrogena Hydro Boost Moisturizing & Hydrating 100% Hydrogel Sheet Face Mask for Dry Skin with Hyaluronic Acid, Gentle & Non-Comedogenic, 1 Ounce (Pack of 12)",4.424688199552286,415,33.24,USD,https://www.amazon.com/dp/B076H45H68/th=1&psc=1,https://www.ulta.com/p/hydro-boost-hyaluronic-acid-water-gel-moisturizer-fragrance-free-pimprod2041883?sku=2615397,"Hydro Boost Hyaluronic Acid Water Gel Moisturizer, Fragrance Free","Hydro Boost Hyaluronic Acid Water Gel Moisturizer, Fragrance Free",
B0C9L29ZYS,Neutrogena,"Neutrogena Fragrance Free Daily Facial Moisturizer, Face & Neck Moisturizer for Sensitive Skin with Vitamin B3, Pro-Vitamin B5 & Vitamin E Supports Skin's Dynamic Barrier, 3.4 fl. oz",4.412121212121212,50,9.49,USD,https://www.amazon.com/dp/B0C9L29ZYS/th=1&psc=1,https://www.ulta.com/p/daily-facial-moisturizer-fragrance-free-pimprod2041038?sku=2615354,Daily Facial Moisturizer - Fragrance Free,Daily Facial Moisturizer - Fragrance Free,
B001P92FMG,Neutrogena,"Neutrogena Sport Face Sunscreen SPF 70+, Oil-Free Facial Sunscreen Lotion with Broad Spectrum UVA/UVB Sun Protection, Sweat-Resistant & Water-Resistant, 2.5 fl. oz",4.65695278464618,1730,,USD,https://www.amazon.com/dp/B001P92FMG/th=1&psc=1,https://www.ulta.com/p/age-shield-face-oil-free-sunscreen-spf-70-xlsImpprod640120?sku=2154550,Age Shield Face Oil-Free Sunscreen SPF 70,Age Shield Face Oil-Free Sunscreen SPF 70,
B0B2TH7C4H,Neutrogena,"Neutrogena Rapid Wrinkle Repair Retinol Pro+ Anti-Wrinkle Eye Cream, Targeted Eye Cream for Wrinkles & Dark Circles, Formulated without Fragrance, Dyes, Phthalates, and Parabens, 0.5 oz",4.182051282051282,123,18.99,USD,https://www.amazon.com/dp/B0B2TH7C4H/th=1&psc=1,https://www.ulta.com/p/makeup-remover-cleansing-towelettes-fragrance-free-xlsImpprod13762447?sku=2298522,Makeup Remover Cleansing Towelettes Fragrance Free,Makeup Remover Cleansing Towelettes Fragrance Free,
B076GZX3KL,Neutrogena,"Neutrogena Ultra Sheer Body Mist SPF 70 Sunscreen Spray, Broad Spectrum UVA/UVB Protection, Lightweight, Non-Greasy Water Resistant Body Sunscreen Mist, Non-Comedogenic, 5 oz",4.707515734912995,403,,USD,https://www.amazon.com/dp/B076GZX3KL/th=1&psc=1,https://www.ulta.com/p/ultra-sheer-non-greasy-spf-60-face-sunscreen-stick-pimprod2049510?sku=2634860,Ultra Sheer Non-Greasy SPF 60 Face Sunscreen Stick,Ultra Sheer Non-Greasy SPF 60 Face Sunscreen Stick,
B0C2ZT9ZG2,Neutrogena,Neutrogena Rapid Wrinkle Repair Retinol Power Facial Serum Age Perfect Midnight Serum Pro+ .5% - 1oz 30ml - (2-Pack Anti Aging Serum 2oz),4.595238095238095,8,27.95,USD,https://www.amazon.com/dp/B0C2ZT9ZG2/th=1&psc=1,https://www.ulta.com/p/ultra-sheer-face-serum-spf-60-pimprod2030654?sku=2592306,Ultra Sheer Face Serum SPF 60+,Ultra Sheer Face Serum SPF 60+,
B005IHT7UE,Neutrogena,"Neutrogena Rapid Wrinkle Repair Anti-Wrinkle Night Accelerated Retinol SA Facial Moisturizer, 1 fl. Oz",4.300291545189505,53,17.97,USD,https://www.amazon.com/dp/B005IHT7UE/th=1&psc=1,https://www.ulta.com/p/rapid-wrinkle-repair-retinol-pro-night-moisturizer-pimprod2035837?sku=2601053,Rapid Wrinkle Repair Retinol Pro+ Night Moisturizer,Rapid Wrinkle Repair Retinol Pro+ Night Moisturizer,
B0B3C4GJJJ,Neutrogena,"Neutrogena Hydro Boost+ Glycolic Acid Overnight Peel, Face Peel with Hyaluronic Acid & 10% Glycolic Acid to Exfoliate & Smooth Dull & Uneven Skin Texture, Fragrance-Free, 3.2 fl. Oz",4.434131736526946,77,16.03,USD,https://www.amazon.com/dp/B0B3C4GJJJ/th=1&psc=1,https://www.ulta.com/p/hydro-boost-hyaluronic-acid-serum-pimprod2017009?sku=2570086,Hydro Boost Hyaluronic Acid Serum,Hydro Boost Hyaluronic Acid Serum,
B07XSB69XJ,Neutrogena,"Neutrogena Fragrance-Free Makeup Remover Cleansing Towelette Singles, Individually-Wrapped Daily Face Wipes 20 ct",4.817543859649123,0,,USD,https://www.amazon.com/dp/B07XSB69XJ/th=1&psc=1,https://www.ulta.com/p/makeup-remover-cleansing-towelettes-fragrance-free-singles-pimprod2009500?sku=2554008,"Makeup Remover Cleansing Towelettes, Fragrance Free Singles","Makeup Remover Cleansing Towelettes, Fragrance Free Singles",
B0C7YQSP9X,Neutrogena,"Neutrogena Hydro Boost Ultra Hydrating Serum with Hyaluronic Acid, Fragrance-Free Face Serum for Weightless Hydration and Softer, Glowing Skin, Non-Comedogenic, 1 fl. oz",4.862068965517241,28,17.01,USD,https://www.amazon.com/dp/B0C7YQSP9X/th=1&psc=1,https://www.ulta.com/p/hydro-boost-niacinamide-face-serum-fragrance-free-pimprod2035838?sku=2601030,Hydro Boost+ Niacinamide Face Serum - Fragrance Free,Hydro Boost+ Niacinamide Face Serum - Fragrance Free,
B0BLRV49MQ,Neutrogena,"Neutrogena Clear Face Serum Sunscreen with Green Tea, Broad Spectrum SPF 60+, Non-Comedogenic Face Sunscreen for Lightweight UVA/UVB Protection, Oxybenzone- & Fragrance-Free, 1.7 fl. Oz",4.462809917355372,70,13.47,USD,https://www.amazon.com/dp/B0BLRV49MQ/th=1&psc=1,https://www.ulta.com/p/kp-bump-eraser-body-scrub-with-10-aha-fresh-peach-pimprod2050342?sku=2635123,KP Bump Eraser Body Scrub with 10% AHA Fresh Peach,KP Bump Eraser Body Scrub with 10% AHA Fresh Peach,
B07MJDSJLH,Neutrogena,"Neutrogena Makeup Remover Cleansing Towelettes, Daily Face Wipes to Remove Dirt, Oil, Makeup & Waterproof Mascara, 25 ct (5 pack + 3 Bonus Pouches)",4.817262816137542,1,39.00,USD,https://www.amazon.com/dp/B07MJDSJLH/th=1&psc=1,https://www.ulta.com/p/milky-moisture-duo-pimprod2049765?sku=2635707,Milky Moisture Duo,Milky Moisture Duo,
B0B4BMFXGL,Neutrogena,"Neutrogena Hydro Boost Soothing Milk Facial Cleanser with Hyaluronic Acid, Hydrating Face Wash Gently Lifts Dirt & Oil Leaving Soft Soothed Skin, Hypoallergenic, Fragrance-Free, 7.8 Fl. Oz",4.312,62,10.99,USD,https://www.amazon.com/dp/B0B4BMFXGL/th=1&psc=1,https://www.ulta.com/p/makeup-remover-cleansing-towelettes-fragrance-free-xlsImpprod13762447?sku=2298522,Makeup Remover Cleansing Towelettes Fragrance Free,Makeup Remover Cleansing Towelettes Fragrance Free,
